[
  {
    "latest" : true,
    "metadata-version" : "2.22.2",
    "source-code-url" : "https://repo.maven.apache.org/maven2/org/apache/maven/surefire/surefire-logger-api/$version$/surefire-logger-api-$version$-sources.jar",
    "repository-url" : "https://github.com/apache/maven-surefire",
    "test-code-url" : "N/A",
    "documentation-url" : "https://repo.maven.apache.org/maven2/org/apache/maven/surefire/surefire-logger-api/$version$/surefire-logger-api-$version$-javadoc.jar",
    "description" : "Surefire Logger API provides dependency-free logging interfaces and utility classes used internally by Apache Maven Surefire components. It centralizes console logging levels, decorators, null logging, and print-stream-backed logging for Surefire and Failsafe runtime code.",
    "tested-versions" : [
      "2.22.2",
      "3.0.0",
      "3.1.0",
      "3.1.2",
      "3.2.1",
      "3.2.2",
      "3.2.3",
      "3.2.5",
      "3.3.0",
      "3.3.1",
      "3.4.0",
      "3.5.0",
      "3.5.1",
      "3.5.2",
      "3.5.3",
      "3.5.4",
      "3.5.5",
      "3.5.6"
    ],
    "allowed-packages" : [
      "org.apache.maven.plugin.surefire.log.api"
    ]
  }
]
