[
  {
    "latest" : true,
    "metadata-version" : "3.65.0",
    "source-code-url" : "https://repo.maven.apache.org/maven2/com/google/cloud/google-cloud-monitoring/$version$/google-cloud-monitoring-$version$-sources.jar",
    "repository-url" : "https://github.com/googleapis/google-cloud-java",
    "test-code-url" : "https://repo.maven.apache.org/maven2/com/google/cloud/google-cloud-monitoring/$version$/google-cloud-monitoring-$version$-tests.jar",
    "documentation-url" : "https://repo.maven.apache.org/maven2/com/google/cloud/google-cloud-monitoring/$version$/google-cloud-monitoring-$version$-javadoc.jar",
    "description" : "Google Cloud Monitoring is the Java client library for the Cloud Monitoring API. It lets JVM applications create and query metrics, monitored resources, alerting policies, uptime checks, and other monitoring data through generated gRPC and HTTP clients.",
    "tested-versions" : [
      "3.65.0",
      "3.67.0",
      "3.68.0",
      "3.69.0",
      "3.71.0",
      "3.72.0",
      "3.73.0",
      "3.74.0",
      "3.75.0",
      "3.76.0",
      "3.77.0",
      "3.78.0",
      "3.79.0",
      "3.80.0",
      "3.81.0",
      "3.82.0",
      "3.83.0",
      "3.84.0",
      "3.85.0",
      "3.86.0",
      "3.87.0",
      "3.88.0",
      "3.89.0",
      "3.91.0",
      "3.92.0",
      "3.93.0"
    ],
    "allowed-packages" : [
      "com.google.cloud.monitoring.v3"
    ]
  }
]
