[
  {
    "latest" : true,
    "metadata-version" : "2.0",
    "source-code-url" : "https://repo.maven.apache.org/maven2/com/github/java-json-tools/jackson-coreutils/$version$/jackson-coreutils-$version$-sources.jar",
    "repository-url" : "https://github.com/java-json-tools/jackson-coreutils",
    "test-code-url" : "https://github.com/java-json-tools/jackson-coreutils/tree/v$version$/src/test",
    "documentation-url" : "https://repo.maven.apache.org/maven2/com/github/java-json-tools/jackson-coreutils/$version$/jackson-coreutils-$version$-javadoc.jar",
    "description" : "jackson-coreutils provides Jackson utilities for JSON Pointer support, JSON numeric equality, precise decimal handling, and stricter JSON node reading. It is intended for JVM applications that use Jackson and need reusable helpers for loading, comparing, and addressing JSON tree data.",
    "tested-versions" : [
      "2.0"
    ],
    "allowed-packages" : [
      "com.github.fge.jackson"
    ]
  }
]
