[
  {
    "latest" : true,
    "metadata-version" : "2.3.0",
    "source-code-url" : "https://repo1.maven.org/maven2/org/junit-pioneer/junit-pioneer/$version$/junit-pioneer-$version$-sources.jar",
    "repository-url" : "https://github.com/junit-pioneer/junit-pioneer",
    "test-code-url" : "https://github.com/junit-pioneer/junit-pioneer/tree/v$version$/src/test",
    "documentation-url" : "https://repo1.maven.org/maven2/org/junit-pioneer/junit-pioneer/$version$/junit-pioneer-$version$-javadoc.jar",
    "description" : "JUnit Pioneer is an extension pack for JUnit 5 that provides experimental extensions for the Jupiter API. It adds utilities for parameterized tests, system properties and environment variables, temporary resources, retries, standard I/O, and other testing scenarios.",
    "tested-versions" : [
      "2.3.0"
    ],
    "allowed-packages" : [
      "org.junitpioneer"
    ]
  }
]
