[
  {
    "latest": true,
    "allowed-packages": [ "javax.inject" ],
    "metadata-version": "1",
    "tested-versions": [
      "1"
    ],
    "source-code-url": "https://repo1.maven.org/maven2/javax/inject/javax.inject/1/javax.inject-1-sources.jar",
    "repository-url": "https://github.com/javax-inject/javax-inject",
    "test-code-url": "https://repo1.maven.org/maven2/javax/inject/javax.inject-tck/1/javax.inject-tck-1-sources.jar",
    "documentation-url": "https://repo1.maven.org/maven2/javax/inject/javax.inject/1/javax.inject-1-javadoc.jar",
    "description": "javax.inject defines a standard set of annotations and a Provider interface for dependency injection in Java. It lets frameworks and applications declare injectable constructors, methods, fields, and qualifiers through a common API."
  }
]
