[
  {
    "latest" : true,
    "metadata-version" : "6.1.26",
    "source-code-url" : "https://repo.maven.apache.org/maven2/org/mortbay/jetty/jetty-sslengine/$version$/jetty-sslengine-$version$-sources.jar",
    "repository-url" : "https://github.com/jetty-project/codehaus-jetty6",
    "test-code-url" : "https://github.com/jetty-project/codehaus-jetty6/tree/jetty-$version$/extras/sslengine/src/test/java/org/mortbay/jetty/security",
    "documentation-url" : "https://repo.maven.apache.org/maven2/org/mortbay/jetty/jetty-sslengine/$version$/jetty-sslengine-$version$-javadoc.jar",
    "description" : "Jetty SSLEngine adds SSL/TLS connector support for Jetty 6 using Java's SSLEngine APIs. It provides the nonblocking SSL endpoint and select-channel connector classes used to serve HTTPS traffic in Mort Bay Jetty.",
    "tested-versions" : [
      "6.1.26"
    ],
    "allowed-packages" : [
      "org.mortbay.jetty.security"
    ]
  }
]
