[
  {
    "latest" : true,
    "metadata-version" : "1.7.36",
    "source-code-url" : "https://repo1.maven.org/maven2/org/slf4j/slf4j-reload4j/$version$/slf4j-reload4j-$version$-sources.jar",
    "repository-url" : "https://github.com/qos-ch/slf4j",
    "test-code-url" : "https://github.com/qos-ch/slf4j/tree/v_$version$/slf4j-reload4j/src/test",
    "documentation-url" : "https://repo1.maven.org/maven2/org/slf4j/slf4j-reload4j/$version$/slf4j-reload4j-$version$-javadoc.jar",
    "description" : "SLF4J Reload4j Binding routes the SLF4J logging API to reload4j, a log4j 1.x compatible logging backend. It lets applications using SLF4J emit log events through reload4j while keeping SLF4J as the application-facing logging facade.",
    "tested-versions" : [
      "1.7.36"
    ],
    "allowed-packages" : [
      "org.slf4j.impl"
    ]
  }
]
