[
  {
    "latest" : true,
    "metadata-version" : "2.6.0",
    "source-code-url" : "https://repo1.maven.org/maven2/com/google/protobuf/protobuf-java/$version$/protobuf-java-$version$-sources.jar",
    "repository-url" : "https://github.com/protocolbuffers/protobuf",
    "test-code-url" : "https://github.com/protocolbuffers/protobuf/tree/v$version$/java/src/test/java",
    "documentation-url" : "https://repo1.maven.org/maven2/com/google/protobuf/protobuf-java/$version$/protobuf-java-$version$-javadoc.jar",
    "description" : "Protocol Buffers are Google's language-neutral, platform-neutral, extensible mechanism for serializing structured data. The protobuf-java artifact provides the Java runtime API used by generated Java message classes to parse, serialize, and work with Protocol Buffer messages.",
    "test-version" : "2.5.0",
    "tested-versions" : [
      "2.6.0"
    ],
    "allowed-packages" : [
      "com.google.protobuf"
    ]
  },
  {
    "metadata-version" : "2.5.0",
    "source-code-url" : "https://repo1.maven.org/maven2/com/google/protobuf/protobuf-java/$version$/protobuf-java-$version$-sources.jar",
    "repository-url" : "https://github.com/protocolbuffers/protobuf",
    "test-code-url" : "https://github.com/protocolbuffers/protobuf/tree/v$version$/java/src/test/java",
    "documentation-url" : "https://repo1.maven.org/maven2/com/google/protobuf/protobuf-java/$version$/protobuf-java-$version$-javadoc.jar",
    "description" : "Protocol Buffers are Google's language-neutral, platform-neutral, extensible mechanism for serializing structured data. The protobuf-java artifact provides the Java runtime API used by generated Java message classes to parse, serialize, and work with Protocol Buffer messages.",
    "tested-versions" : [
      "2.5.0"
    ],
    "allowed-packages" : [
      "com.google.protobuf"
    ]
  }
]
