[
  {
    "latest" : true,
    "metadata-version" : "2.22.2",
    "source-code-url" : "https://repo.maven.apache.org/maven2/org/apache/maven/surefire/maven-surefire-common/$version$/maven-surefire-common-$version$-sources.jar",
    "repository-url" : "https://github.com/apache/maven-surefire",
    "test-code-url" : "https://repo.maven.apache.org/maven2/org/apache/maven/surefire/surefire/$version$/surefire-$version$-source-release.zip",
    "documentation-url" : "https://repo.maven.apache.org/maven2/org/apache/maven/surefire/maven-surefire-common/$version$/maven-surefire-common-$version$-javadoc.jar",
    "description" : "Maven Surefire Common provides shared APIs and implementation support used by the Maven Surefire and Failsafe plugins to configure and run test providers. It includes code for classpath construction, forking, test scanning, reporting, provider resolution, and related plugin-side test execution infrastructure.",
    "tested-versions" : [
      "2.22.2"
    ],
    "allowed-packages" : [
      "org.apache.maven.plugin.surefire",
      "org.apache.maven.surefire"
    ]
  }
]
