[
  {
    "latest" : true,
    "metadata-version" : "2.5.0-b05",
    "source-code-url" : "https://repo.maven.apache.org/maven2/org/glassfish/hk2/hk2-api/$version$/hk2-api-$version$-sources.jar",
    "repository-url" : "https://github.com/javaee/hk2",
    "test-code-url" : "https://github.com/javaee/hk2/tree/$version$/hk2-api/src/test",
    "documentation-url" : "https://repo.maven.apache.org/maven2/org/glassfish/hk2/hk2-api/$version$/hk2-api-$version$-javadoc.jar",
    "description" : "HK2 API provides the core contracts, annotations, descriptors, and service locator interfaces for the HK2 dependency injection framework. It lets applications and HK2 extensions describe services, manage dynamic configurations, resolve injections, define scopes, and observe service lifecycle events.",
    "tested-versions" : [
      "2.5.0-b05"
    ],
    "allowed-packages" : [
      "org.glassfish.hk2",
      "org.jvnet.hk2.annotations"
    ]
  },
  {
    "metadata-version" : "2.6.1",
    "source-code-url" : "https://repo.maven.apache.org/maven2/org/glassfish/hk2/hk2-api/$version$/hk2-api-$version$-sources.jar",
    "repository-url" : "https://github.com/eclipse-ee4j/glassfish-hk2",
    "test-code-url" : "https://github.com/eclipse-ee4j/glassfish-hk2/tree/$version$/hk2-api/src/test",
    "documentation-url" : "https://repo.maven.apache.org/maven2/org/glassfish/hk2/hk2-api/$version$/hk2-api-$version$-javadoc.jar",
    "description" : "HK2 API provides the core contracts, annotations, descriptors, and service locator interfaces for the HK2 dependency injection framework. It lets applications and HK2 extensions describe services, manage dynamic configurations, resolve injections, define scopes, and observe service lifecycle events.",
    "tested-versions" : [
      "2.6.1"
    ],
    "allowed-packages" : [
      "org.glassfish.hk2",
      "org.jvnet.hk2.annotations"
    ]
  },
  {
    "metadata-version" : "2.6.0",
    "source-code-url" : "https://repo.maven.apache.org/maven2/org/glassfish/hk2/hk2-api/$version$/hk2-api-$version$-sources.jar",
    "repository-url" : "https://github.com/eclipse-ee4j/glassfish-hk2",
    "test-code-url" : "https://github.com/eclipse-ee4j/glassfish-hk2/tree/$version$/hk2-api/src/test",
    "documentation-url" : "https://repo.maven.apache.org/maven2/org/glassfish/hk2/hk2-api/$version$/hk2-api-$version$-javadoc.jar",
    "description" : "HK2 API provides the core contracts, annotations, descriptors, and service locator interfaces for the HK2 dependency injection framework. It lets applications and HK2 extensions describe services, manage dynamic configurations, resolve injections, define scopes, and observe service lifecycle events.",
    "tested-versions" : [
      "2.6.0"
    ],
    "allowed-packages" : [
      "org.glassfish.hk2",
      "org.jvnet.hk2.annotations"
    ]
  },
  {
    "metadata-version" : "2.5.0",
    "source-code-url" : "https://repo.maven.apache.org/maven2/org/glassfish/hk2/hk2-api/$version$/hk2-api-$version$-sources.jar",
    "repository-url" : "https://github.com/eclipse-ee4j/glassfish-hk2",
    "test-code-url" : "https://github.com/eclipse-ee4j/glassfish-hk2/tree/$version$-RELEASE/hk2-api/src/test",
    "documentation-url" : "https://repo.maven.apache.org/maven2/org/glassfish/hk2/hk2-api/$version$/hk2-api-$version$-javadoc.jar",
    "description" : "HK2 API provides the core contracts, annotations, descriptors, and service locator interfaces for the HK2 dependency injection framework. It lets applications and HK2 extensions describe services, manage dynamic configurations, resolve injections, define scopes, and observe service lifecycle events.",
    "tested-versions" : [
      "2.5.0"
    ],
    "allowed-packages" : [
      "org.glassfish.hk2",
      "org.jvnet.hk2.annotations"
    ]
  }
]
