[
  {
    "latest" : true,
    "metadata-version" : "2.43.0",
    "source-code-url" : "https://repo.maven.apache.org/maven2/com/diffplug/spotless/spotless-maven-plugin/$version$/spotless-maven-plugin-$version$-sources.jar",
    "repository-url" : "https://github.com/diffplug/spotless",
    "test-code-url" : "https://github.com/diffplug/spotless/tree/maven/$version$/plugin-maven/src/test/java",
    "documentation-url" : "https://repo.maven.apache.org/maven2/com/diffplug/spotless/spotless-maven-plugin/$version$/spotless-maven-plugin-$version$-javadoc.jar",
    "description" : "Spotless Maven Plugin integrates Spotless code formatting into Maven builds with goals that check and apply formatting. It supports formatter configuration for Java, Kotlin, Groovy, Scala, JavaScript, TypeScript, Markdown, XML, JSON, SQL, shell scripts, and other files through Spotless libraries and external formatter tools.",
    "tested-versions" : [
      "2.43.0"
    ],
    "allowed-packages" : [
      "com.diffplug.spotless.maven"
    ]
  }
]
