[
  {
    "latest" : true,
    "metadata-version" : "1.5.3",
    "tested-versions" : [
      "1.5.3"
    ],
    "allowed-packages" : [
      "org.objectweb.asm.attrs"
    ],
    "source-code-url" : "https://gitlab.ow2.org/asm/asm/-/tree/ASM_1_5_3/asm/src/org/objectweb/asm/attrs",
    "test-code-url" : "https://gitlab.ow2.org/asm/asm/-/tree/ASM_1_5_3/asm/test/conform/org/objectweb/asm/attrs",
    "documentation-url" : "N/A",
    "repository-url" : "https://gitlab.ow2.org/asm/asm"
  }
]
