[
  {
    "latest" : true,
    "metadata-version" : "10.5.0",
    "source-code-url" : "https://repo1.maven.org/maven2/com/netflix/graphql/dgs/graphql-dgs-client/$version$/graphql-dgs-client-$version$-sources.jar",
    "repository-url" : "https://github.com/Netflix/dgs-framework",
    "test-code-url" : "https://github.com/Netflix/dgs-framework/tree/v$version$/graphql-dgs-client/src/test",
    "documentation-url" : "https://netflix.github.io/dgs/",
    "description" : "The DGS client is part of Netflix's Domain Graph Service framework and provides a GraphQL client for sending queries, mutations and subscriptions to GraphQL servers. It supports building requests from typed query objects and deserializing the responses over transports such as Spring WebClient, RestClient and RSocket.",
    "tested-versions" : [
      "10.5.0"
    ],
    "allowed-packages" : [
      "com.netflix.graphql.dgs.client"
    ]
  }
]
