[
  {
    "metadata-version" : "3.0.0",
    "source-code-url" : "https://repo.maven.apache.org/maven2/jakarta/servlet/jsp/jstl/jakarta.servlet.jsp.jstl-api/$version$/jakarta.servlet.jsp.jstl-api-$version$-sources.jar",
    "repository-url" : "https://github.com/jakartaee/tags",
    "test-code-url" : "https://download.eclipse.org/jakartaee/tags/3.0/jakarta-tags-tck-$version$.zip",
    "documentation-url" : "https://repo.maven.apache.org/maven2/jakarta/servlet/jsp/jstl/jakarta.servlet.jsp.jstl-api/$version$/jakarta.servlet.jsp.jstl-api-$version$-javadoc.jar",
    "description" : "Jakarta Standard Tag Library API defines the standard tag interfaces, support classes, validators, and utility APIs used by JSP tag libraries. It provides the API surface for core, formatting, SQL, XML, and tag-library validation features that application servers and JSTL implementations expose to Jakarta Servlet and JSP applications.",
    "tested-versions" : [
      "3.0.0",
      "3.0.1",
      "3.0.2"
    ],
    "allowed-packages" : [
      "jakarta.servlet.jsp.jstl"
    ]
  },
  {
    "latest" : true,
    "metadata-version" : "3.1.0-M1",
    "source-code-url" : "https://repo.maven.apache.org/maven2/jakarta/servlet/jsp/jstl/jakarta.servlet.jsp.jstl-api/$version$/jakarta.servlet.jsp.jstl-api-$version$-sources.jar",
    "repository-url" : "https://github.com/jakartaee/tags",
    "test-code-url" : "https://github.com/jakartaee/tags/tree/$version$-RELEASE/tck",
    "documentation-url" : "https://repo.maven.apache.org/maven2/jakarta/servlet/jsp/jstl/jakarta.servlet.jsp.jstl-api/$version$/jakarta.servlet.jsp.jstl-api-$version$-javadoc.jar",
    "description" : "Jakarta Standard Tag Library API defines the standard tag interfaces, support classes, validators, and utility APIs used by JSP tag libraries. It provides the API surface for core, formatting, SQL, XML, and tag-library validation features that application servers and JSTL implementations expose to Jakarta Servlet and JSP applications.",
    "tested-versions" : [
      "3.1.0-M1",
      "3.1.0-M2"
    ],
    "allowed-packages" : [
      "jakarta.servlet.jsp.jstl"
    ]
  }
]
