[
  {
    "latest" : true,
    "metadata-version" : "5.1.15",
    "source-code-url" : "https://repo.maven.apache.org/maven2/io/micronaut/micronaut-http-client/$version$/micronaut-http-client-$version$-sources.jar",
    "repository-url" : "https://github.com/micronaut-projects/micronaut-core",
    "test-code-url" : "https://github.com/micronaut-projects/micronaut-core/tree/v$version$/http-client/src/test",
    "documentation-url" : "https://repo.maven.apache.org/maven2/io/micronaut/micronaut-http-client/$version$/micronaut-http-client-$version$-javadoc.jar",
    "description" : "Micronaut HTTP Client provides the Netty-based, non-blocking implementation of Micronaut's HTTP client, supporting both declarative (@Client) and low-level programmatic APIs for making HTTP and WebSocket requests. It builds on the transport-independent abstractions from micronaut-http-client-core to perform the actual network I/O using Netty.",
    "tested-versions" : [
      "5.1.15"
    ],
    "allowed-packages" : [
      "io.micronaut.http.client.netty"
    ]
  }
]
