[
  {
    "latest" : true,
    "metadata-version" : "4.1.0",
    "source-code-url" : "https://repo.maven.apache.org/maven2/org/springframework/boot/spring-boot-batch/$version$/spring-boot-batch-$version$-sources.jar",
    "repository-url" : "https://github.com/spring-projects/spring-boot",
    "test-code-url" : "https://github.com/spring-projects/spring-boot/tree/v$version$/module/spring-boot-batch/src/test/java",
    "documentation-url" : "https://repo.maven.apache.org/maven2/org/springframework/boot/spring-boot-batch/$version$/spring-boot-batch-$version$-javadoc.jar",
    "description" : "Spring Boot Batch provides auto-configuration and support classes for running Spring Batch jobs in Spring Boot applications. It configures the job repository, job launcher, and job runner so that batch jobs can be executed at startup with minimal setup.",
    "tested-versions" : [
      "4.1.0"
    ],
    "allowed-packages" : [
      "org.springframework.boot.batch.autoconfigure"
    ]
  }
]
