[
  {
    "latest" : true,
    "metadata-version" : "2.7.18",
    "source-code-url" : "https://repo.maven.apache.org/maven2/org/springframework/data/spring-data-commons/$version$/spring-data-commons-$version$-sources.jar",
    "repository-url" : "https://github.com/spring-projects/spring-data-commons",
    "test-code-url" : "https://github.com/spring-projects/spring-data-commons/tree/$version$/src/test",
    "documentation-url" : "https://repo.maven.apache.org/maven2/org/springframework/data/spring-data-commons/$version$/spring-data-commons-$version$-javadoc.jar",
    "description" : "Spring Data Commons provides the shared repository, mapping, auditing, conversion, and pagination infrastructure used by Spring Data modules. It supplies datastore-neutral abstractions and integration support that reduce boilerplate for data access layers across different persistence technologies.",
    "tested-versions" : [
      "2.7.18"
    ],
    "allowed-packages" : [
      "org.springframework.data"
    ]
  }
]
