[
  {
    "latest" : true,
    "metadata-version" : "2.34.0",
    "source-code-url" : "https://repo.maven.apache.org/maven2/software/amazon/awssdk/kms/$version$/kms-$version$-sources.jar",
    "repository-url" : "https://github.com/aws/aws-sdk-java-v2",
    "test-code-url" : "https://github.com/aws/aws-sdk-java-v2/tree/$version$/services/kms/src/it",
    "documentation-url" : "https://repo.maven.apache.org/maven2/software/amazon/awssdk/kms/$version$/kms-$version$-javadoc.jar",
    "description" : "This module provides the AWS SDK for Java v2 client classes for AWS Key Management Service (AWS KMS). It lets JVM applications create, manage, and use KMS keys, aliases, and key policies through the generated AWS KMS service client.",
    "tested-versions" : [
      "2.34.0",
      "2.34.1",
      "2.34.2",
      "2.34.3",
      "2.34.4",
      "2.34.5",
      "2.34.6",
      "2.34.7",
      "2.34.8",
      "2.34.9",
      "2.35.0",
      "2.35.1",
      "2.35.2",
      "2.35.3",
      "2.35.4",
      "2.35.5",
      "2.35.6",
      "2.35.7",
      "2.35.8",
      "2.35.9",
      "2.35.10",
      "2.35.11",
      "2.36.0",
      "2.36.1",
      "2.36.2",
      "2.36.3",
      "2.37.0",
      "2.37.1",
      "2.37.2",
      "2.37.3",
      "2.37.4",
      "2.37.5",
      "2.38.0",
      "2.38.1",
      "2.38.2",
      "2.38.3",
      "2.38.4",
      "2.38.5",
      "2.38.6",
      "2.38.7",
      "2.38.8",
      "2.38.9",
      "2.39.0",
      "2.39.1",
      "2.39.2",
      "2.39.3",
      "2.39.4",
      "2.39.5",
      "2.39.6",
      "2.40.0",
      "2.40.1",
      "2.40.2",
      "2.40.3",
      "2.40.4",
      "2.40.5",
      "2.40.6",
      "2.40.7",
      "2.40.8",
      "2.40.9",
      "2.40.10",
      "2.40.11",
      "2.40.12",
      "2.40.13",
      "2.40.14",
      "2.40.15",
      "2.40.16",
      "2.40.17",
      "2.41.0",
      "2.41.1",
      "2.41.2",
      "2.41.3",
      "2.41.4",
      "2.41.5",
      "2.41.6",
      "2.41.7",
      "2.41.8",
      "2.41.9",
      "2.41.10",
      "2.41.11",
      "2.41.12",
      "2.41.13",
      "2.41.14",
      "2.41.15",
      "2.41.16",
      "2.41.17",
      "2.41.18",
      "2.41.19",
      "2.41.20",
      "2.41.21",
      "2.41.22",
      "2.41.23",
      "2.41.24",
      "2.41.25",
      "2.41.26",
      "2.41.27",
      "2.41.28",
      "2.41.29",
      "2.41.30",
      "2.41.31",
      "2.41.32",
      "2.41.33",
      "2.41.34",
      "2.42.0",
      "2.42.1",
      "2.42.2",
      "2.42.3",
      "2.42.4",
      "2.42.5",
      "2.42.6",
      "2.42.7",
      "2.42.8",
      "2.42.9",
      "2.42.10",
      "2.42.11",
      "2.42.12",
      "2.42.13",
      "2.42.14",
      "2.42.15",
      "2.42.16",
      "2.42.17",
      "2.42.18",
      "2.42.19",
      "2.42.20",
      "2.42.21",
      "2.42.22",
      "2.42.23",
      "2.42.24",
      "2.42.25",
      "2.42.26",
      "2.42.27",
      "2.42.28",
      "2.42.29",
      "2.42.30",
      "2.42.31",
      "2.42.32",
      "2.42.33",
      "2.42.34",
      "2.42.35",
      "2.42.36",
      "2.42.37",
      "2.42.38",
      "2.42.39",
      "2.42.40",
      "2.42.41",
      "2.43.0",
      "2.43.1",
      "2.43.2",
      "2.44.0",
      "2.44.1",
      "2.44.2",
      "2.44.3",
      "2.44.4",
      "2.44.5",
      "2.44.6",
      "2.44.7",
      "2.44.8",
      "2.44.9",
      "2.44.10",
      "2.44.11",
      "2.44.12",
      "2.44.13",
      "2.44.14",
      "2.45.0",
      "2.45.1",
      "2.46.0",
      "2.46.1",
      "2.46.2",
      "2.46.3",
      "2.46.4",
      "2.46.5",
      "2.46.6",
      "2.46.7",
      "2.46.8",
      "2.46.9",
      "2.46.10",
      "2.46.11",
      "2.46.12",
      "2.46.13",
      "2.46.14",
      "2.46.15",
      "2.46.16",
      "2.46.17",
      "2.46.18",
      "2.46.19",
      "2.46.20",
      "2.46.21",
      "2.47.0",
      "2.47.1",
      "2.47.2",
      "2.47.3",
      "2.47.4",
      "2.47.5",
      "2.47.6",
      "2.48.0",
      "2.48.1",
      "2.48.2",
      "2.48.3",
      "2.48.4",
      "2.49.0",
      "2.49.1",
      "2.49.2",
      "2.49.3"
    ],
    "allowed-packages" : [
      "software.amazon.awssdk.services.kms"
    ]
  }
]
