[
  {
    "latest" : true,
    "metadata-version" : "2.0.0.Final",
    "tested-versions" : [
      "2.0.0.Final"
    ],
    "allowed-packages" : [
      "javax.validation"
    ]
  },
  {
    "metadata-version" : "1.1.0.Final",
    "source-code-url" : "https://repo1.maven.org/maven2/javax/validation/validation-api/1.1.0.Final/validation-api-1.1.0.Final-sources.jar",
    "repository-url" : "https://github.com/jakartaee/validation",
    "test-code-url" : "https://github.com/jakartaee/validation/tree/1.1.0.Final/src/test",
    "documentation-url" : "https://repo1.maven.org/maven2/javax/validation/validation-api/1.1.0.Final/validation-api-1.1.0.Final-javadoc.jar",
    "description" : "Bean Validation API defines the standard Java annotations and interfaces for declaring and inspecting constraints on objects, properties, method parameters, and return values. It provides the JSR 349 contracts that validation providers implement so applications can use a portable validation model without depending on a specific provider.",
    "tested-versions" : [
      "1.1.0.Final"
    ],
    "allowed-packages" : [
      "javax.validation"
    ]
  },
  {
    "metadata-version" : "1.0.0.GA",
    "source-code-url" : "https://repo1.maven.org/maven2/javax/validation/validation-api/1.0.0.GA/validation-api-1.0.0.GA-sources.jar",
    "repository-url" : "https://github.com/jakartaee/validation",
    "test-code-url" : "https://github.com/jakartaee/validation/tree/1.0.0.GA/src/test",
    "documentation-url" : "https://repo1.maven.org/maven2/javax/validation/validation-api/1.0.0.GA/validation-api-1.0.0.GA-javadoc.jar",
    "description" : "Bean Validation API defines the standard Java annotations and interfaces for declaring and inspecting constraints on objects, properties, method parameters, and return values. It provides the JSR 303 contracts that validation providers implement so applications can use a portable validation model without depending on a specific provider.",
    "tested-versions" : [
      "1.0.0.GA"
    ],
    "allowed-packages" : [
      "javax.validation"
    ]
  }
]
