[
  {
    "latest" : true,
    "metadata-version" : "11.0.24",
    "tested-versions" : [
      "11.0.24"
    ],
    "allowed-packages" : [
      "org.eclipse.jetty.alpn.java.client"
    ],
    "source-code-url" : "https://github.com/jetty/jetty.project/tree/jetty-$version$/jetty-alpn/jetty-alpn-java-client/src/main",
    "test-code-url" : "https://github.com/jetty/jetty.project/tree/jetty-$version$/jetty-alpn/jetty-alpn-java-client/src/test",
    "documentation-url" : "N/A",
    "repository-url" : "https://github.com/jetty/jetty.project"
  }
]
