[
  {
    "latest" : true,
    "metadata-version" : "2.0.2",
    "tested-versions" : [
      "2.0.2"
    ],
    "allowed-packages" : [
      "org.apache.ws.commons.schema"
    ],
    "source-code-url" : "https://repo1.maven.org/maven2/org/apache/ws/xmlschema/xmlschema-core/$version$/xmlschema-core-$version$-sources.jar",
    "test-code-url" : "https://github.com/apache/ws-xmlschema/tree/xmlschema-$version$/xmlschema-core/src/test",
    "documentation-url" : "https://javadoc.io/doc/org.apache.ws.xmlschema/xmlschema-core/$version$",
    "repository-url" : "https://github.com/apache/ws-xmlschema"
  }
]
