[
  {
    "latest" : true,
    "metadata-version" : "4.38.0",
    "source-code-url" : "https://repo.maven.apache.org/maven2/com/github/victools/jsonschema-module-jackson/$version$/jsonschema-module-jackson-$version$-sources.jar",
    "repository-url" : "https://github.com/victools/jsonschema-generator",
    "test-code-url" : "https://github.com/victools/jsonschema-generator/tree/v$version$/jsonschema-module-jackson/src/test/java",
    "documentation-url" : "https://repo.maven.apache.org/maven2/com/github/victools/jsonschema-module-jackson/$version$/jsonschema-module-jackson-$version$-javadoc.jar",
    "description" : "jsonschema-module-jackson is an extension module for victools jsonschema-generator that derives JSON Schema attributes from Jackson annotations. It maps Jackson metadata such as descriptions, property names, ignored members, required properties, enum handling, subtype information, and unwrapped properties into the generated schema.",
    "tested-versions" : [
      "4.38.0"
    ],
    "allowed-packages" : [
      "com.github.victools.jsonschema.module.jackson"
    ]
  }
]
