[
  {
    "latest" : true,
    "metadata-version" : "1.5.7",
    "source-code-url" : "https://repo.maven.apache.org/maven2/com/networknt/json-schema-validator/$version$/json-schema-validator-$version$-sources.jar",
    "repository-url" : "https://github.com/networknt/json-schema-validator",
    "test-code-url" : "https://github.com/networknt/json-schema-validator/tree/$version$/src/test",
    "documentation-url" : "https://repo.maven.apache.org/maven2/com/networknt/json-schema-validator/$version$/json-schema-validator-$version$-javadoc.jar",
    "description" : "json-schema-validator is a Java library for validating JSON documents against JSON Schema drafts including draft-04, draft-06, draft-07, 2019-09, and 2020-12. It provides configurable schema loading, format validation, error reporting, and OpenAPI-oriented validation support for JVM applications.",
    "tested-versions" : [
      "1.5.7",
      "1.5.8",
      "1.5.9"
    ],
    "allowed-packages" : [
      "com.networknt.org.apache.commons.validator.routines",
      "com.networknt.schema"
    ]
  },
  {
    "metadata-version" : "2.0.0",
    "source-code-url" : "https://repo.maven.apache.org/maven2/com/networknt/json-schema-validator/$version$/json-schema-validator-$version$-sources.jar",
    "repository-url" : "https://github.com/networknt/json-schema-validator",
    "test-code-url" : "https://github.com/networknt/json-schema-validator/tree/$version$/src/test",
    "documentation-url" : "https://repo.maven.apache.org/maven2/com/networknt/json-schema-validator/$version$/json-schema-validator-$version$-javadoc.jar",
    "description" : "json-schema-validator is a Java library for validating JSON documents against JSON Schema drafts including draft-04, draft-06, draft-07, 2019-09, and 2020-12. It provides configurable schema loading, format validation, error reporting, and OpenAPI-oriented validation support for JVM applications.",
    "tested-versions" : [
      "2.0.0"
    ],
    "allowed-packages" : [
      "com.networknt.org.apache.commons.validator.routines",
      "com.networknt.schema"
    ]
  }
]
