[
  {
    "latest" : true,
    "metadata-version" : "5.0.0",
    "source-code-url" : "https://repo1.maven.org/maven2/com/github/victools/jsonschema-module-swagger-2/$version$/jsonschema-module-swagger-2-$version$-sources.jar",
    "repository-url" : "https://github.com/victools/jsonschema-generator",
    "test-code-url" : "https://github.com/victools/jsonschema-generator/tree/v$version$/jsonschema-module-swagger-2/src/test",
    "documentation-url" : "https://repo1.maven.org/maven2/com/github/victools/jsonschema-module-swagger-2/$version$/jsonschema-module-swagger-2-$version$-javadoc.jar",
    "description" : "jsonschema-module-swagger-2 is a Java extension for victools/jsonschema-generator that reads Swagger Core 2.x annotations while generating JSON Schema from Java types. It maps Swagger annotation metadata, such as descriptions, required flags, formats, bounds, nullability, and composition, into the generated schema.",
    "tested-versions" : [
      "5.0.0"
    ],
    "allowed-packages" : [
      "com.github.victools.jsonschema.module.swagger2"
    ]
  },
  {
    "metadata-version" : "4.38.0",
    "source-code-url" : "https://repo1.maven.org/maven2/com/github/victools/jsonschema-module-swagger-2/$version$/jsonschema-module-swagger-2-$version$-sources.jar",
    "repository-url" : "https://github.com/victools/jsonschema-generator",
    "test-code-url" : "https://github.com/victools/jsonschema-generator/tree/v$version$/jsonschema-module-swagger-2/src/test",
    "documentation-url" : "https://repo1.maven.org/maven2/com/github/victools/jsonschema-module-swagger-2/$version$/jsonschema-module-swagger-2-$version$-javadoc.jar",
    "description" : "jsonschema-module-swagger-2 is an extension for victools/jsonschema-generator that reads Swagger Core 2.x annotations while producing JSON Schema from Java types. It maps annotation metadata such as descriptions, titles, references, composition, required flags, nullability, defaults, access modes, formats, patterns, numeric bounds, and array constraints into generated schema attributes.",
    "tested-versions" : [
      "4.38.0"
    ],
    "allowed-packages" : [
      "com.github.victools.jsonschema.module.swagger2"
    ]
  }
]
